Funktion;Text
Consequence;(2) Zur Änderung der bisherigen Nutzung der Pachtsache ist die vorherige Erlaubnis des Verpächters nur dann erforderlich, wenn durch die Änderung die Art der Nutzung über die Pachtzeit hinaus beeinflusst wird.
Permission;Der Pächter darf Gebäude nur mit vorheriger Erlaubnis des Verpächters errichten.
Permission;Verweigert der Verpächter die Erlaubnis, so kann sie auf Antrag des Pächters durch das Landwirtschaftsgericht ersetzt werden, soweit die Änderung zur Erhaltung oder nachhaltigen Verbesserung der Rentabilität des Betriebs geeignet erscheint und dem Verpächter bei Berücksichtigung seiner berechtigten Interessen zugemutet werden kann.
Continuation;Dies gilt nicht, wenn der Pachtvertrag gekündigt ist oder das Pachtverhältnis in weniger als drei Jahren endet.
Permission;Das Landwirtschaftsgericht kann die Erlaubnis unter Bedingungen und Auflagen ersetzen, insbesondere eine Sicherheitsleistung anordnen sowie Art und Umfang der Sicherheit bestimmen.
Consequence;Ist die Veranlassung für die Sicherheitsleistung weggefallen, so entscheidet auf Antrag das Landwirtschaftsgericht über die Rückgabe der Sicherheit.
Permission;(3) Hat der Pächter das nach § 582a zum Schätzwert übernommene Inventar im Zusammenhang mit einer Änderung der Nutzung der Pachtsache wesentlich vermindert, so kann der Verpächter schon während der Pachtzeit einen Geldausgleich in entsprechender Anwendung des § 582a Abs. 3 verlangen, es sei denn, dass der Erlös der veräußerten Inventarstücke zu einer zur Höhe des Erlöses in angemessenem Verhältnis stehenden Verbesserung der Pachtsache nach § 591 verwendet worden ist.
Permission;Macht der Pächter von der Pachtsache einen vertragswidrigen Gebrauch und setzt er den Gebrauch ungeachtet einer Abmahnung des Verpächters fort, so kann der Verpächter auf Unterlassung klagen.
Duty;Der Verpächter ist verpflichtet, dem Pächter die notwendigen Verwendungen auf die Pachtsache zu ersetzen.
Duty;(1) Andere als notwendige Verwendungen, denen der Verpächter zugestimmt hat, hat er dem Pächter bei Beendigung des Pachtverhältnisses zu ersetzen, soweit die Verwendungen den Wert der Pachtsache über die Pachtzeit hinaus erhöhen (Mehrwert).
Permission;(2) Weigert sich der Verpächter, den Verwendungen zuzustimmen, so kann die Zustimmung auf Antrag des Pächters durch das Landwirtschaftsgericht ersetzt werden, soweit die Verwendungen zur Erhaltung oder nachhaltigen Verbesserung der Rentabilität des Betriebs geeignet sind und dem Verpächter bei Berücksichtigung seiner berechtigten Interessen zugemutet werden können.
Continuation;Dies gilt nicht, wenn der Pachtvertrag gekündigt ist oder das Pachtverhältnis in weniger als drei Jahren endet.
Permission;Das Landwirtschaftsgericht kann die Zustimmung unter Bedingungen und Auflagen ersetzen.
Permission;(3) Das Landwirtschaftsgericht kann auf Antrag auch über den Mehrwert Bestimmungen treffen und ihn festsetzen.
Permission;Es kann bestimmen, dass der Verpächter den Mehrwert nur in Teilbeträgen zu ersetzen hat, und kann Bedingungen für die Bewilligung solcher Teilzahlungen festsetzen.
Permission;Ist dem Verpächter ein Ersatz des Mehrwerts bei Beendigung des Pachtverhältnisses auch in Teilbeträgen nicht zuzumuten, so kann der Pächter nur verlangen, dass das Pachtverhältnis zu den bisherigen Bedingungen so lange fortgesetzt wird, bis der Mehrwert der Pachtsache abgegolten ist.
Consequence;Kommt keine Einigung zustande, so entscheidet auf Antrag das Landwirtschaftsgericht über eine Fortsetzung des Pachtverhältnisses.
Permission;Der Pächter ist berechtigt, eine Einrichtung, mit der er die Sache versehen hat, wegzunehmen.
Permission;Der Verpächter kann die Ausübung des Wegnahmerechts durch Zahlung einer angemessenen Entschädigung abwenden, es sei denn, dass der Pächter ein berechtigtes Interesse an der Wegnahme hat.
Objection;Eine Vereinbarung, durch die das Wegnahmerecht des Pächters ausgeschlossen wird, ist nur wirksam, wenn ein angemessener Ausgleich vorgesehen ist.
Consequence;(1) Die Ersatzansprüche des Verpächters wegen Veränderung oder Verschlechterung der verpachteten Sache sowie die Ansprüche des Pächters auf Ersatz von Verwendungen oder auf Gestattung der Wegnahme einer Einrichtung verjähren in sechs Monaten.
Consequence;(2) Die Verjährung der Ersatzansprüche des Verpächters beginnt mit dem Zeitpunkt, in welchem er die Sache zurückerhält.
Consequence;Die Verjährung der Ansprüche des Pächters beginnt mit der Beendigung des Pachtverhältnisses.
Consequence;(3) Mit der Verjährung des Anspruchs des Verpächters auf Rückgabe der Sache verjähren auch die Ersatzansprüche des Verpächters.
Consequence;Der Verpächter hat für seine Forderungen aus dem Pachtverhältnis ein Pfandrecht an den eingebrachten Sachen des Pächters sowie an den Früchten der Pachtsache.
Prohibition;Für künftige Entschädigungsforderungen kann das Pfandrecht nicht geltend gemacht werden.
Consequence;Mit Ausnahme der in § 811 Abs. 1 Nr. 4 der Zivilprozessordnung genannten Sachen erstreckt sich das Pfandrecht nicht auf Sachen, die der Pfändung nicht unterworfen sind.
Reference;Die Vorschriften der §§ 562a bis 562c gelten entsprechend.
Permission;(1) Haben sich nach Abschluss des Pachtvertrags die Verhältnisse, die für die Festsetzung der Vertragsleistungen maßgebend waren, nachhaltig so geändert, dass die gegenseitigen Verpflichtungen in ein grobes Missverhältnis zueinander geraten sind, so kann jeder Vertragsteil eine Änderung des Vertrags mit Ausnahme der Pachtdauer verlangen.
Prohibition;Verbessert oder verschlechtert sich infolge der Bewirtschaftung der Pachtsache durch den Pächter deren Ertrag, so kann, soweit nichts anderes vereinbart ist, eine Änderung der Pacht nicht verlangt werden.
Permission;(2) Eine Änderung kann frühestens zwei Jahre nach Beginn des Pachtverhältnisses oder nach dem Wirksamwerden der letzten Änderung der Vertragsleistungen verlangt werden.
Continuation;Dies gilt nicht, wenn verwüstende Naturereignisse, gegen die ein Versicherungsschutz nicht üblich ist, das Verhältnis der Vertragsleistungen grundlegend und nachhaltig verändert haben.
Prohibition;(3) Die Änderung kann nicht für eine frühere Zeit als für das Pachtjahr verlangt werden, in dem das Änderungsverlangen erklärt wird.
Permission;(4) Weigert sich ein Vertragsteil, in eine Änderung des Vertrags einzuwilligen, so kann der andere Teil die Entscheidung des Landwirtschaftsgerichts beantragen.
Prohibition;(5) Auf das Recht, eine Änderung des Vertrags nach den Absätzen 1 bis 4 zu verlangen, kann nicht verzichtet werden.
Objection;Eine Vereinbarung, dass einem Vertragsteil besondere Nachteile oder Vorteile erwachsen sollen, wenn er die Rechte nach den Absätzen 1 bis 4 ausübt oder nicht ausübt, ist unwirksam.
Consequence;Wird bei der Übergabe eines Betriebs im Wege der vorweggenommenen Erbfolge ein zugepachtetes Grundstück, das der Landwirtschaft dient, mit übergeben, so tritt der Übernehmer anstelle des Pächters in den Pachtvertrag ein.
Duty;Der Verpächter ist von der Betriebsübergabe jedoch unverzüglich zu benachrichtigen.
Permission;Ist die ordnungsmäßige Bewirtschaftung der Pachtsache durch den Übernehmer nicht gewährleistet, so ist der Verpächter berechtigt, das Pachtverhältnis außerordentlich mit der gesetzlichen Frist zu kündigen.
Reference;Wird das verpachtete Grundstück veräußert oder mit dem Recht eines Dritten belastet, so gelten die §§ 566 bis 567b entsprechend.
Consequence;Das Pachtverhältnis endet mit dem Ablauf der Zeit, für die es eingegangen ist.
Consequence;Es verlängert sich bei Pachtverträgen, die auf mindestens drei Jahre geschlossen worden sind, auf unbestimmte Zeit, wenn auf die Anfrage eines Vertragsteils, ob der andere Teil zur Fortsetzung des Pachtverhältnisses bereit ist, dieser nicht binnen einer Frist von drei Monaten die Fortsetzung ablehnt.
Consequence;Die Anfrage und die Ablehnung bedürfen der schriftlichen Form.
Objection;Die Anfrage ist ohne Wirkung, wenn in ihr nicht auf die Folge der Nichtbeachtung ausdrücklich hingewiesen wird und wenn sie nicht innerhalb des drittletzten Pachtjahrs gestellt wird.
Permission;(1) Ist die Pachtzeit nicht bestimmt, so kann jeder Vertragsteil das Pachtverhältnis spätestens am dritten Werktag eines Pachtjahrs für den Schluss des nächsten Pachtjahrs kündigen.
Consequence;Die Vereinbarung einer kürzeren Frist bedarf der Schriftform.
Objection;"(2) Für die Fälle, in denen das Pachtverhältnis außerordentlich mit der gesetzlichen Frist vorzeitig gekündigt werden kann, ist die Kündigung nur für den Schluss eines Pachtjahrs zulässig; sie hat spätestens am dritten Werktag des halben Jahres zu erfolgen, mit dessen Ablauf die Pacht enden soll."
Permission;Wird ein Pachtvertrag für eine längere Zeit als 30 Jahre geschlossen, so kann nach 30 Jahren jeder Vertragsteil das Pachtverhältnis spätestens am dritten Werktag eines Pachtjahrs für den Schluss des nächsten Pachtjahrs kündigen.
Objection;Die Kündigung ist nicht zulässig, wenn der Vertrag für die Lebenszeit des Verpächters oder des Pächters geschlossen ist.
Permission;Ist der Pächter berufsunfähig im Sinne der Vorschriften der gesetzlichen Rentenversicherung geworden, so kann er das Pachtverhältnis außerordentlich mit der gesetzlichen Frist kündigen, wenn der Verpächter der Überlassung der Pachtsache zur Nutzung an einen Dritten, der eine ordnungsmäßige Bewirtschaftung gewährleistet, widerspricht.
Objection;Eine abweichende Vereinbarung ist unwirksam.
Permission;(1) Stirbt der Pächter, so sind sowohl seine Erben als auch der Verpächter innerhalb eines Monats, nachdem sie vom Tod des Pächters Kenntnis erlangt haben, berechtigt, das Pachtverhältnis mit einer Frist von sechs Monaten zum Ende eines Kalendervierteljahrs zu kündigen.
Permission;(2) Die Erben können der Kündigung des Verpächters widersprechen und die Fortsetzung des Pachtverhältnisses verlangen, wenn die ordnungsmäßige Bewirtschaftung der Pachtsache durch sie oder durch einen von ihnen beauftragten Miterben oder Dritten gewährleistet erscheint.
Permission;Der Verpächter kann die Fortsetzung des Pachtverhältnisses ablehnen, wenn die Erben den Widerspruch nicht spätestens drei Monate vor Ablauf des Pachtverhältnisses erklärt und die Umstände mitgeteilt haben, nach denen die weitere ordnungsmäßige Bewirtschaftung der Pachtsache gewährleistet erscheint.
Consequence;Die Widerspruchserklärung und die Mitteilung bedürfen der schriftlichen Form.
Consequence;Kommt keine Einigung zustande, so entscheidet auf Antrag das Landwirtschaftsgericht.
Objection;(3) Gegenüber einer Kündigung des Verpächters nach Absatz 1 ist ein Fortsetzungsverlangen des Erben nach § 595 ausgeschlossen.
Objection;(1) Die außerordentliche fristlose Kündigung des Pachtverhältnisses ist in entsprechender Anwendung der §§ 543, 569 Abs. 1 und 2 zulässig.
Objection;Ist die Pacht nach Zeitabschnitten von weniger als einem Jahr bemessen, so ist die Kündigung erst zulässig, wenn der Pächter für zwei aufeinander folgende Termine mit der Entrichtung der Pacht oder eines nicht unerheblichen Teils der Pacht in Verzug ist.
Consequence;Die Kündigung bedarf der schriftlichen Form.
Permission;(1) Der Pächter kann vom Verpächter die Fortsetzung des Pachtverhältnisses verlangen, wenn 1.bei einem Betriebspachtverhältnis der Betrieb seine wirtschaftliche Lebensgrundlage bildet,2.bei dem Pachtverhältnis über ein Grundstück der Pächter auf dieses Grundstück zur Aufrechterhaltung seines Betriebs, der seine wirtschaftliche Lebensgrundlage bildet, angewiesen istund die vertragsmäßige Beendigung des Pachtverhältnisses für den Pächter oder seine Familie eine Härte bedeuten würde, die auch unter Würdigung der berechtigten Interessen des Verpächters nicht zu rechtfertigen ist.
Permission;Die Fortsetzung kann unter diesen Voraussetzungen wiederholt verlangt werden.
Permission;(2) Im Falle des Absatzes 1 kann der Pächter verlangen, dass das Pachtverhältnis so lange fortgesetzt wird, wie dies unter Berücksichtigung aller Umstände angemessen ist.
Permission;Ist dem Verpächter nicht zuzumuten, das Pachtverhältnis nach den bisher geltenden Vertragsbedingungen fortzusetzen, so kann der Pächter nur verlangen, dass es unter einer angemessenen Änderung der Bedingungen fortgesetzt wird.
Prohibition;(3) Der Pächter kann die Fortsetzung des Pachtverhältnisses nicht verlangen, wenn 1.er das Pachtverhältnis gekündigt hat,2.der Verpächter zur außerordentlichen fristlosen Kündigung oder im Falle des § 593a zur außerordentlichen Kündigung mit der gesetzlichen Frist berechtigt ist,3.die Laufzeit des Vertrags bei einem Pachtverhältnis über einen Betrieb, der Zupachtung von Grundstücken, durch die ein Betrieb entsteht, oder bei einem Pachtverhältnis über Moor- und Ödland, das vom Pächter kultiviert worden ist, auf mindestens 18 Jahre, bei der Pacht anderer Grundstücke auf mindestens zwölf Jahre vereinbart ist,4.der Verpächter die nur vorübergehend verpachtete Sache in eigene Nutzung nehmen oder zur Erfüllung gesetzlicher oder sonstiger öffentlicher Aufgaben verwenden will.
Consequence;(4) Die Erklärung des Pächters, mit der er die Fortsetzung des Pachtverhältnisses verlangt, bedarf der schriftlichen Form.
Duty;Auf Verlangen des Verpächters soll der Pächter über die Gründe des Fortsetzungsverlangens unverzüglich Auskunft erteilen.
Permission;(5) Der Verpächter kann die Fortsetzung des Pachtverhältnisses ablehnen, wenn der Pächter die Fortsetzung nicht mindestens ein Jahr vor Beendigung des Pachtverhältnisses vom Verpächter verlangt oder auf eine Anfrage des Verpächters nach § 594 die Fortsetzung abgelehnt hat.
Consequence;Ist eine zwölfmonatige oder kürzere Kündigungsfrist vereinbart, so genügt es, wenn das Verlangen innerhalb eines Monats nach Zugang der Kündigung erklärt wird.
Consequence;(6) Kommt keine Einigung zustande, so entscheidet auf Antrag das Landwirtschaftsgericht über eine Fortsetzung und über die Dauer des Pachtverhältnisses sowie über die Bedingungen, zu denen es fortgesetzt wird.
Permission;Das Gericht kann die Fortsetzung des Pachtverhältnisses jedoch nur bis zu einem Zeitpunkt anordnen, der die in Absatz 3 Nr. 3 genannten Fristen, ausgehend vom Beginn des laufenden Pachtverhältnisses, nicht übersteigt.
Permission;Die Fortsetzung kann auch auf einen Teil der Pachtsache beschränkt werden.
Duty;(7) Der Pächter hat den Antrag auf gerichtliche Entscheidung spätestens neun Monate vor Beendigung des Pachtverhältnisses und im Falle einer zwölfmonatigen oder kürzeren Kündigungsfrist zwei Monate nach Zugang der Kündigung bei dem Landwirtschaftsgericht zu stellen.
Permission;Das Gericht kann den Antrag nachträglich zulassen, wenn es zur Vermeidung einer unbilligen Härte geboten erscheint und der Pachtvertrag noch nicht abgelaufen ist.
Permission;(8) Auf das Recht, die Verlängerung eines Pachtverhältnisses nach den Absätzen 1 bis 7 zu verlangen, kann nur verzichtet werden, wenn der Verzicht zur Beilegung eines Pachtstreits vor Gericht oder vor einer berufsständischen Pachtschlichtungsstelle erklärt wird.
Objection;Eine Vereinbarung, dass einem Vertragsteil besondere Nachteile oder besondere Vorteile erwachsen sollen, wenn er die Rechte nach den Absätzen 1 bis 7 ausübt oder nicht ausübt, ist unwirksam.
Indemnity;Veränderungen oder Verschlechterungen der Mietsache, die durch den vertragsgemäßen Gebrauch herbeigeführt werden, hat der Mieter nicht zu vertreten.
Indemnity;Veränderungen oder Verschlechterungen der Mietsache, die durch den vertragsgemäßen Gebrauch herbeigeführt werden, hat der Mieter nicht zu vertreten.
Duty;(2) Überlässt der Mieter den Gebrauch einem Dritten, so hat er ein dem Dritten bei dem Gebrauch zur Last fallendes Verschulden zu vertreten, auch wenn der Vermieter die Erlaubnis zur Überlassung erteilt hat.
Definition;(2) Ein wichtiger Grund liegt insbesondere vor, wenn 1.dem Mieter der vertragsgemäße Gebrauch der Mietsache ganz oder zum Teil nicht rechtzeitig gewährt oder wieder entzogen wird, 2.der Mieter die Rechte des Vermieters dadurch in erheblichem Maße verletzt, dass er die Mietsache durch Vernachlässigung der ihm obliegenden Sorgfalt erheblich gefährdet oder sie unbefugt einem Dritten überlässt oder 3.der Mietera)für zwei aufeinander folgende Termine mit der Entrichtung der Miete oder eines nicht unerheblichen Teils der Miete in Verzug ist oder b)in einem Zeitraum, der sich über mehr als zwei Termine erstreckt, mit der Entrichtung der Miete in Höhe eines Betrages in Verzug ist, der die Miete für zwei Monate erreicht.
Reference;(2) Die Vorschriften über die Miethöhe bei Mietbeginn in Gebieten mit angespannten Wohnungsmärkten (§§ 556d bis 556g), über die Mieterhöhung (§§ 557 bis 561) und über den Mieterschutz bei Beendigung des Mietverhältnisses sowie bei der Begründung von Wohnungseigentum (§ 568 Abs. 2, §§ 573, 573a, 573d Abs. 1, §§ 574 bis 575, 575a Abs. 1 und §§ 577, 577a) gelten nicht für Mietverhältnisse über 1.Wohnraum, der nur zum vorübergehenden Gebrauch vermietet ist,2.Wohnraum, der Teil der vom Vermieter selbst bewohnten Wohnung ist und den der Vermieter überwiegend mit Einrichtungsgegenständen auszustatten hat, sofern der Wohnraum dem Mieter nicht zum dauernden Gebrauch mit seiner Familie oder mit Personen überlassen ist, mit denen er einen auf Dauer angelegten gemeinsamen Haushalt führt,3.Wohnraum, den eine juristische Person des öffentlichen Rechts oder ein anerkannter privater Träger der Wohlfahrtspflege angemietet hat, um ihn Personen mit dringendem Wohnungsbedarf zu überlassen, wenn sie den Mieter bei Vertragsschluss auf die Zweckbestimmung des Wohnraums und die Ausnahme von den genannten Vorschriften hingewiesen hat.
Reference;(2) Die Vorschriften über die Miethöhe bei Mietbeginn in Gebieten mit angespannten Wohnungsmärkten (§§ 556d bis 556g), über die Mieterhöhung (§§ 557 bis 561) und über den Mieterschutz bei Beendigung des Mietverhältnisses sowie bei der Begründung von Wohnungseigentum (§ 568 Abs. 2, §§ 573, 573a, 573d Abs. 1, §§ 574 bis 575, 575a Abs. 1 und §§ 577, 577a) gelten nicht für Mietverhältnisse über 1.Wohnraum, der nur zum vorübergehenden Gebrauch vermietet ist,2.Wohnraum, der Teil der vom Vermieter selbst bewohnten Wohnung ist und den der Vermieter überwiegend mit Einrichtungsgegenständen auszustatten hat, sofern der Wohnraum dem Mieter nicht zum dauernden Gebrauch mit seiner Familie oder mit Personen überlassen ist, mit denen er einen auf Dauer angelegten gemeinsamen Haushalt führt,3.Wohnraum, den eine juristische Person des öffentlichen Rechts oder ein anerkannter privater Träger der Wohlfahrtspflege angemietet hat, um ihn Personen mit dringendem Wohnungsbedarf zu überlassen, wenn sie den Mieter bei Vertragsschluss auf die Zweckbestimmung des Wohnraums und die Ausnahme von den genannten Vorschriften hingewiesen hat.
Reference;(2) Die Vorschriften über die Miethöhe bei Mietbeginn in Gebieten mit angespannten Wohnungsmärkten (§§ 556d bis 556g), über die Mieterhöhung (§§ 557 bis 561) und über den Mieterschutz bei Beendigung des Mietverhältnisses sowie bei der Begründung von Wohnungseigentum (§ 568 Abs. 2, §§ 573, 573a, 573d Abs. 1, §§ 574 bis 575, 575a Abs. 1 und §§ 577, 577a) gelten nicht für Mietverhältnisse über 1.Wohnraum, der nur zum vorübergehenden Gebrauch vermietet ist,2.Wohnraum, der Teil der vom Vermieter selbst bewohnten Wohnung ist und den der Vermieter überwiegend mit Einrichtungsgegenständen auszustatten hat, sofern der Wohnraum dem Mieter nicht zum dauernden Gebrauch mit seiner Familie oder mit Personen überlassen ist, mit denen er einen auf Dauer angelegten gemeinsamen Haushalt führt,3.Wohnraum, den eine juristische Person des öffentlichen Rechts oder ein anerkannter privater Träger der Wohlfahrtspflege angemietet hat, um ihn Personen mit dringendem Wohnungsbedarf zu überlassen, wenn sie den Mieter bei Vertragsschluss auf die Zweckbestimmung des Wohnraums und die Ausnahme von den genannten Vorschriften hingewiesen hat.
Reference;(3) Für Wohnraum in einem Studenten- oder Jugendwohnheim gelten die §§ 556d bis 561 sowie die §§ 573, 573a, 573d Abs. 1 und §§ 575, 575a Abs. 1, §§ 577, 577a nicht.
Consequence;Wird der Mietvertrag für längere Zeit als ein Jahr nicht in schriftlicher Form geschlossen, so gilt er für unbestimmte Zeit.
Duty;Die Modernisierungsankündigung muss Angaben enthalten über: 1.die Art und den voraussichtlichen Umfang der Modernisierungsmaßnahme in wesentlichen Zügen,2.den voraussichtlichen Beginn und die voraussichtliche Dauer der Modernisierungsmaßnahme,3.den Betrag der zu erwartenden Mieterhöhung, sofern eine Erhöhung nach § 559 verlangt werden soll, sowie die voraussichtlichen künftigen Betriebskosten.
Consequence;"Die zu erwartende Mieterhöhung sowie die voraussichtlichen künftigen Betriebskosten bleiben bei der Abwägung im Rahmen der Duldungspflicht außer Betracht; sie sind nur nach § 559 Absatz 4 und 5 bei einer Mieterhöhung zu berücksichtigen."
Duty;"(3) Über die Vorauszahlungen für Betriebskosten ist jährlich abzurechnen; dabei ist der Grundsatz der Wirtschaftlichkeit zu beachten."
Indemnity;Der Vermieter ist zu Teilabrechnungen nicht verpflichtet.
Permission;(1) Wird ein Mietvertrag über Wohnraum abgeschlossen, der in einem durch Rechtsverordnung nach Absatz 2 bestimmten Gebiet mit einem angespannten Wohnungsmarkt liegt, so darf die Miete zu Beginn des Mietverhältnisses die ortsübliche Vergleichsmiete (§ 558 Absatz 2) höchstens um 10 Prozent übersteigen.
Continuation;Dies kann insbesondere dann der Fall sein, wenn 1.die Mieten deutlich stärker steigen als im bundesweiten Durchschnitt,2.die durchschnittliche Mietbelastung der Haushalte den bundesweiten Durchschnitt deutlich übersteigt,3.die Wohnbevölkerung wächst, ohne dass durch Neubautätigkeit insoweit erforderlicher Wohnraum geschaffen wird, oder4.geringer Leerstand bei großer Nachfrage besteht.
Duty;Eine Rechtsverordnung nach Satz 1 muss spätestens am 31. Dezember 2020 in Kraft treten.
Duty;Sie muss begründet werden.
Duty;Aus der Begründung muss sich ergeben, auf Grund welcher Tatsachen ein Gebiet mit einem angespannten Wohnungsmarkt im Einzelfall vorliegt.
Duty;Ferner muss sich aus der Begründung ergeben, welche Maßnahmen die Landesregierung in dem nach Satz 1 durch die Rechtsverordnung jeweils bestimmten Gebiet und Zeitraum ergreifen wird, um Abhilfe zu schaffen.
Permission;(1) Ist die Miete, die der vorherige Mieter zuletzt schuldete (Vormiete), höher als die nach § 556d Absatz 1 zulässige Miete, so darf eine Miete bis zur Höhe der Vormiete vereinbart werden.
Permission;(2) Hat der Vermieter in den letzten drei Jahren vor Beginn des Mietverhältnisses Modernisierungsmaßnahmen im Sinne des § 555b durchgeführt, so darf die nach § 556d Absatz 1 zulässige Miete um den Betrag überschritten werden, der sich bei einer Mieterhöhung nach § 559 Absatz 1 bis 3 und § 559a Absatz 1 bis 4 ergäbe.
Reference;§ 556d ist nicht anzuwenden auf eine Wohnung, die nach dem 1. Oktober 2014 erstmals genutzt und vermietet wird.
Reference;Die §§ 556d und 556e sind nicht anzuwenden auf die erste Vermietung nach umfassender Modernisierung.
Continuation;Für Vereinbarungen über die Miethöhe bei Mietbeginn gilt dies nur, soweit die zulässige Miete überschritten wird.
Duty;Der Vermieter hat dem Mieter zu viel gezahlte Miete nach den Vorschriften über die Herausgabe einer ungerechtfertigten Bereicherung herauszugeben.
Reference;Die §§ 814 und 817 Satz 2 sind nicht anzuwenden.
Permission;(2) Der Mieter kann von dem Vermieter eine nach den §§ 556d und 556e nicht geschuldete Miete nur zurückverlangen, wenn er einen Verstoß gegen die Vorschriften dieses Unterkapitels gerügt hat und die zurückverlangte Miete nach Zugang der Rüge fällig geworden ist.
Duty;Die Rüge muss die Tatsachen enthalten, auf denen die Beanstandung der vereinbarten Miete beruht.
Duty;(3) Der Vermieter ist auf Verlangen des Mieters verpflichtet, Auskunft über diejenigen Tatsachen zu erteilen, die für die Zulässigkeit der vereinbarten Miete nach den Vorschriften dieses Unterkapitels maßgeblich sind, soweit diese Tatsachen nicht allgemein zugänglich sind und der Vermieter hierüber unschwer Auskunft geben kann.
Reference;Für die Auskunft über Modernisierungsmaßnahmen (§ 556e Absatz 2) gilt § 559b Absatz 1 Satz 2 und 3 entsprechend.
Consequence;(4) Sämtliche Erklärungen nach den Absätzen 2 und 3 bedürfen der Textform.
Permission;"(1) Die Miete kann für bestimmte Zeiträume in unterschiedlicher Höhe schriftlich vereinbart werden; in der Vereinbarung ist die jeweilige Miete oder die jeweilige Erhöhung in einem Geldbetrag auszuweisen (Staffelmiete)."
Reference;(4) Die §§ 556d bis 556g sind auf jede Mietstaffel anzuwenden.
Reference;(4) Die §§ 556d bis 556g sind nur auf die Ausgangsmiete einer Indexmietvereinbarung anzuwenden.
Consequence;"(2) Kosten, die für Erhaltungsmaßnahmen erforderlich gewesen wären, gehören nicht zu den aufgewendeten Kosten nach Absatz 1; sie sind, soweit erforderlich, durch Schätzung zu ermitteln."
Consequence;(1) Kosten, die vom Mieter oder für diesen von einem Dritten übernommen oder die mit Zuschüssen aus öffentlichen Haushalten gedeckt werden, gehören nicht zu den aufgewendeten Kosten im Sinne des § 559.(2) Werden die Kosten für die Modernisierungsmaßnahmen ganz oder teilweise durch zinsverbilligte oder zinslose Darlehen aus öffentlichen Haushalten gedeckt, so verringert sich der Erhöhungsbetrag nach § 559 um den Jahresbetrag der Zinsermäßigung.
